{
  "agent_id": "meridian.servicing.settlement_risk",
  "name": "Asset Servicing Settlement Risk Analysis",
  "description": "Fan-in analytics agent: consumes settlement status, custody positions, and cash position outputs to compute failed-settlement aging, CSDR cash-penalty exposure basis, and firm-policy settlement-risk flags. Computes from supplied producer data; does not fetch data and does not claim mandatory buy-in is active.",
  "version": "1.0.0",
  "provider": {
    "organization": "Meridian Demo Bank"
  },
  "domain": "asset-servicing",
  "audience": "segment",
  "sub_domain": "custody-operations",
  "max_response_tokens": 2500,
  "protocol": "mcp",
  "connection": {
    "server_url": "http://servicing-mcp:8082/mcp",
    "tool": "analyze_settlement_risk",
    "transport": "streamable"
  },
  "capabilities": {
    "streaming": false,
    "pushNotifications": false
  },
  "skills": [
    {
      "id": "analyze_settlement_risk",
      "name": "analyze_settlement_risk",
      "description": "Analyse settlement risk from settlement, custody, and cash data: failed-trade aging, failed amount exposure, CSDR cash-penalty exposure basis, and firm-policy flags without asserting that mandatory buy-in is active.",
      "tags": [
        "settlement-risk",
        "failed-settlements",
        "csdr",
        "cash-penalties",
        "custody",
        "asset-servicing"
      ],
      "examples": [
        "what is the settlement risk on this servicing relationship",
        "assess settlement risk with custody holdings and cash balance context",
        "are failed settlements over our firm policy age threshold",
        "does this fund have settlement fails creating cash penalty exposure",
        "assess settlement risk using cash and custody context",
        "what settlement issues need escalation using cash custody and settlement context"
      ],
      "inputModes": [
        "application/json"
      ],
      "outputModes": [
        "application/json"
      ]
    }
  ],
  "constraints": {
    "access_mode": "read",
    "data_classification": "confidential-pii",
    "sla_timeout_ms": 15000
  },
  "output_schema": {
    "type": "object",
    "properties": {
      "failed_amount_usd": {
        "type": "number"
      },
      "breach_count": {
        "type": "integer"
      },
      "aging": {
        "type": "object",
        "properties": {
          "max_failed_age_days": {
            "type": "integer"
          }
        }
      },
      "cash_context": {
        "type": "object",
        "properties": {
          "failed_exposure_to_settled_cash_pct": {
            "type": [
              "number",
              "null"
            ]
          }
        }
      },
      "custody_context": {
        "type": "object",
        "properties": {
          "failed_exposure_to_custody_mv_pct": {
            "type": [
              "number",
              "null"
            ]
          }
        }
      }
    }
  },
  "io": {
    "consumes": [
      {
        "from": "servicing.settlement_status",
        "required": true,
        "select": "{'relationship_id': has(input.relationship_id) ? input.relationship_id : null, 'pending': has(input.pending) ? input.pending : null, 'failed': has(input.failed) ? input.failed : null, 'as_of_date': has(input.as_of_date) ? input.as_of_date : null}"
      },
      {
        "from": "servicing.custody_positions",
        "required": true,
        "select": "{'relationship_id': has(input.relationship_id) ? input.relationship_id : null, 'holdings_by_custodian': has(input.holdings_by_custodian) ? input.holdings_by_custodian : null, 'as_of_date': has(input.as_of_date) ? input.as_of_date : null}"
      },
      {
        "from": "servicing.cash_position",
        "required": true,
        "select": "{'relationship_id': has(input.relationship_id) ? input.relationship_id : null, 'balances': has(input.balances) ? input.balances : null, 'projected_cash_usd': has(input.projected_cash_usd) ? input.projected_cash_usd : null, 'note': has(input.note) ? input.note : null, 'as_of_date': has(input.as_of_date) ? input.as_of_date : null}"
      }
    ],
    "produces": [
      {
        "name": "settlement_analysis",
        "type": "servicing.settlement_analysis",
        "figures": [
          {
            "label": "CSDR penalty failed settlement amount",
            "path": "has(output.failed_amount_usd) ? output.failed_amount_usd : null",
            "format": "currency_usd"
          },
          {
            "label": "Max failed age",
            "path": "has(output.aging) && has(output.aging.max_failed_age_days) ? output.aging.max_failed_age_days : null",
            "format": "count"
          },
          {
            "label": "Settlement breach count",
            "path": "has(output.breach_count) ? output.breach_count : null",
            "format": "count"
          },
          {
            "label": "Failed exposure to settled cash",
            "path": "has(output.cash_context) && has(output.cash_context.failed_exposure_to_settled_cash_pct) ? output.cash_context.failed_exposure_to_settled_cash_pct : null",
            "format": "percent1"
          },
          {
            "label": "Failed exposure to custody market value",
            "path": "has(output.custody_context) && has(output.custody_context.failed_exposure_to_custody_mv_pct) ? output.custody_context.failed_exposure_to_custody_mv_pct : null",
            "format": "percent1"
          }
        ]
      }
    ]
  }
}
